{0,"1.2.840.10008.1.1","Verification SOP Class","SOP Class",},//
{0,"1.2.840.10008.1.2","Implicit VR Little Endian: Default Transfer Syntax for DICOM","Transfer Syntax",},//
{0,"1.2.840.10008.1.2.1","Explicit VR Little Endian","Transfer Syntax",},//
{0,"1.2.840.10008.1.2.1.99","Deflated Explicit VR Little Endian","Transfer Syntax",},//
{0,"1.2.840.10008.1.2.2","Explicit VR Big Endian","Transfer Syntax",},//
{0,"1.2.840.10008.1.2.4.50","JPEG Baseline (Process 1): Default Transfer Syntax for Lossy JPEG 8 Bit Image Compression","Transfer Syntax",},//
{0,"1.2.840.10008.1.2.4.51","JPEG Extended (Process 2 & 4): Default Transfer Syntax for Lossy JPEG 12 Bit Image Compression (Process 4 only)","Transfer Syntax",},//
{0,"1.2.840.10008.1.2.4.52","JPEG Extended (Process 3 & 5) (Retired)","Transfer Syntax",},//
{0,"1.2.840.10008.1.2.4.53","JPEG Spectral Selection, Non-Hierarchical (Process 6 & 8) (Retired)","Transfer Syntax",},//
{0,"1.2.840.10008.1.2.4.54","JPEG Spectral Selection, Non-Hierarchical (Process 7 & 9) (Retired)","Transfer Syntax",},//
{0,"1.2.840.10008.1.2.4.55","JPEG Full Progression, Non-Hierarchical (Process 10 & 12) (Retired)","Transfer Syntax",},//
{0,"1.2.840.10008.1.2.4.56","JPEG Full Progression, Non-Hierarchical (Process 11 & 13) (Retired)","Transfer Syntax",},//
{0,"1.2.840.10008.1.2.4.57","JPEG Lossless, Non-Hierarchical (Process 14)","Transfer Syntax",},//
{0,"1.2.840.10008.1.2.4.58","JPEG Lossless, Non-Hierarchical (Process 15) (Retired)","Transfer Syntax",},//
{0,"1.2.840.10008.1.2.4.59","JPEG Extended, Hierarchical (Process 16 & 18) (Retired)","Transfer Syntax",},//
{0,"1.2.840.10008.1.2.4.60","JPEG Extended, Hierarchical (Process 17 & 19) (Retired)","Transfer Syntax",},//
{0,"1.2.840.10008.1.2.4.61","JPEG Spectral Selection, Hierarchical (Process 20 & 22) (Retired)","Transfer Syntax",},//
{0,"1.2.840.10008.1.2.4.62","JPEG Spectral Selection, Hierarchical (Process 21 & 23) (Retired)","Transfer Syntax",},//
{0,"1.2.840.10008.1.2.4.63","JPEG Full Progression, Hierarchical (Process 24 & 26) (Retired)","Transfer Syntax",},//
{0,"1.2.840.10008.1.2.4.64","JPEG Full Progression, Hierarchical (Process 25 & 27) (Retired)","Transfer Syntax",},//
{0,"1.2.840.10008.1.2.4.65","JPEG Lossless, Hierarchical (Process 28) (Retired)","Transfer Syntax",},//
{0,"1.2.840.10008.1.2.4.66","JPEG Lossless, Hierarchical (Process 29) (Retired)","Transfer Syntax",},//
{0,"1.2.840.10008.1.2.4.70","JPEG Lossless, Non-Hierarchical, First-Order Prediction (Process 14[Selection Value 1]): Default Transfer Syntax for Lossless JPEG Image Compression","Transfer Syntax",},//
{0,"1.2.840.10008.1.2.4.80","JPEG-LS Lossless Image Compression","Transfer Syntax",},//
{0,"1.2.840.10008.1.2.4.81","JPEG-LS Lossy (Near-Lossless) Image Compression","Transfer Syntax",},//
{0,"1.2.840.10008.1.2.4.90","JPEG 2000 Image Compression (Lossless Only)","Transfer Syntax",},//
{0,"1.2.840.10008.1.2.4.91","JPEG 2000 Image Compression","Transfer Syntax",},//
{0,"1.2.840.10008.1.2.5","RLE Lossless","Transfer Syntax",},//
{0,"1.2.840.10008.1.3.10","Media Storage Directory Storage","SOP Class",},//
{0,"1.2.840.10008.1.9","Basic Study Content Notification SOP Class","SOP Class",},//
{0,"1.2.840.10008.1.20.1","Storage Commitment Push Model SOP Class","SOP Class",},//
{0,"1.2.840.10008.1.20.1.1","Storage Commitment Push Model SOP Instance","Well-known SOP Instance",},//
{0,"1.2.840.10008.1.20.2","Storage Commitment Pull Model SOP Class (Retired)","SOP Class",},//
{0,"1.2.840.10008.1.20.2.1","Storage Commitment Pull Model SOP Instance (Retired)","Well-known SOP Instance",},//
{0,"1.2.840.10008.2.16.4","DICOM Controlled Terminology","Coding Scheme",},//
{0,"1.2.840.10008.3.1.1.1","DICOM Application Context Name","Application Context Name",},//
{0,"1.2.840.10008.3.1.2.1.1","Detached Patient Management SOP Class","SOP Class",},//
{0,"1.2.840.10008.3.1.2.1.4","Detached Patient Management Meta SOP Class Meta","SOP Class",},//
{0,"1.2.840.10008.3.1.2.2.1","Detached Visit Management SOP Class","SOP Class",},//
{0,"1.2.840.10008.3.1.2.3.1","Detached Study Management SOP Class","SOP Class",},//
{0,"1.2.840.10008.3.1.2.3.2","Study Component Management SOP Class","SOP Class",},//
{0,"1.2.840.10008.3.1.2.3.3","Modality Performed Procedure Step SOP Class","SOP Class",},//
{0,"1.2.840.10008.3.1.2.3.4","Modality Performed Procedure Step Retrieve SOP Class","SOP Class",},//
{0,"1.2.840.10008.3.1.2.3.5","Modality Performed Procedure Step Notification SOP Class","SOP Class",},//
{0,"1.2.840.10008.3.1.2.5.1","Detached Results Management SOP Class","SOP Class",},//
{0,"1.2.840.10008.3.1.2.5.4","Detached Results Management Meta SOP Class Meta","SOP Class",},//
{0,"1.2.840.10008.3.1.2.5.5","Detached Study Management Meta SOP Class Meta","SOP Class",},//
{0,"1.2.840.10008.3.1.2.6.1","Detached Interpretation Management SOP Class","SOP Class",},//
{0,"1.2.840.10008.5.1.1.1","Basic Film Session SOP Class","SOP Class",},//
{0,"1.2.840.10008.5.1.1.2","Basic Film Box SOP Class","SOP Class",},//
{0,"1.2.840.10008.5.1.1.4","Basic Grayscale Image Box SOP Class","SOP Class",},//
{0,"1.2.840.10008.5.1.1.4.1","Basic Color Image Box SOP Class","SOP Class",},//
{0,"1.2.840.10008.5.1.1.4.2","Referenced Image Box SOP Class (Retired)","SOP Class",},//
{0,"1.2.840.10008.5.1.1.9","Basic Grayscale Print Management Meta SOP Class Meta","SOP Class",},//
{0,"1.2.840.10008.5.1.1.9.1","Referenced Grayscale Print Management Meta SOP Class (Retired) Meta","SOP Class",},//
{0,"1.2.840.10008.5.1.1.14","Print Job SOP Class","SOP Class",},//
{0,"1.2.840.10008.5.1.1.15","Basic Annotation Box SOP Class","SOP Class",},//
{0,"1.2.840.10008.5.1.1.16","Printer SOP Class","SOP Class",},//
{0,"1.2.840.10008.5.1.1.16.376","Printer Configuration Retrieval SOP Class","SOP Class",},//
{0,"1.2.840.10008.5.1.1.17","Printer SOP Instance","Well-known Printer SOP Instance",},//
{0,"1.2.840.10008.5.1.1.17.376","Printer Configuration Retrieval SOP Instance","Well-known Printer SOP Instance",},//
{0,"1.2.840.10008.5.1.1.18","Basic Color Print Management Meta SOP Class Meta","SOP Class",},//
{0,"1.2.840.10008.5.1.1.18.1","Referenced Color Print Management Meta SOP Class (Retired) Meta","SOP Class",},//
{0,"1.2.840.10008.5.1.1.22","VOI LUT Box SOP Class","SOP Class",},//
{0,"1.2.840.10008.5.1.1.23","Presentation LUT SOP Class","SOP Class",},//
{0,"1.2.840.10008.5.1.1.24","Image Overlay Box SOP Class (Retired)","SOP Class",},//
{0,"1.2.840.10008.5.1.1.24.1","Basic Print Image Overlay Box SOP Class","SOP Class",},//
{0,"1.2.840.10008.5.1.1.25","Print Queue SOP Instance","Well-known Print Queue SOP Instance",},//
{0,"1.2.840.10008.5.1.1.26","Print Queue Management SOP Class","SOP Class",},//
{0,"1.2.840.10008.5.1.1.27","Stored Print Storage SOP Class","SOP Class",},//
{0,"1.2.840.10008.5.1.1.29","Hardcopy Grayscale Image Storage SOP Class","SOP Class",},//
{0,"1.2.840.10008.5.1.1.30","Hardcopy Color Image Storage SOP Class","SOP Class",},//
{0,"1.2.840.10008.5.1.1.31","Pull Print Request SOP Class","SOP Class",},//
{0,"1.2.840.10008.5.1.1.32","Pull Stored Print Management Meta SOP Class Meta","SOP Class",},//
{0,"1.2.840.10008.5.1.4.1.1.1","Computed Radiography Image Storage","SOP Class",},//
{0,"1.2.840.10008.5.1.4.1.1.1.1","Digital X-Ray Image Storage ? For Presentation","SOP Class",},//
{0,"1.2.840.10008.5.1.4.1.1.1.1.1","Digital X-Ray Image Storage ? For Processing","SOP Class",},//
{0,"1.2.840.10008.5.1.4.1.1.1.2","Digital Mammography X-Ray Image Storage ? For Presentation","SOP Class",},//
{0,"1.2.840.10008.5.1.4.1.1.1.2.1","Digital Mammography X-Ray Image Storage ? For Processing","SOP Class",},//
{0,"1.2.840.10008.5.1.4.1.1.1.3","Digital Intra-oral X-Ray Image Storage ? For Presentation","SOP Class",},//
{0,"1.2.840.10008.5.1.4.1.1.1.3.1","Digital Intra-oral X-Ray Image Storage ? For Processing","SOP Class",},//
{0,"1.2.840.10008.5.1.4.1.1.2","CT Image Storage","SOP Class",},//
{0,"1.2.840.10008.5.1.4.1.1.3","Ultrasound Multi-frame Image Storage (Retired)","SOP Class",},//
{0,"1.2.840.10008.5.1.4.1.1.3.1","Ultrasound Multi-frame Image Storage","SOP Class",},//
{0,"1.2.840.10008.5.1.4.1.1.4","MR Image Storage","SOP Class",},//
{0,"1.2.840.10008.5.1.4.1.1.4.1","Enhanced MR Image Storage","SOP Class",},//
{0,"1.2.840.10008.5.1.4.1.1.4.2","MR Spectroscopy Storage","SOP Class",},//
{0,"1.2.840.10008.5.1.4.1.1.5","Nuclear Medicine Image Storage (Retired)","SOP Class",},//
{0,"1.2.840.10008.5.1.4.1.1.6","Ultrasound Image Storage (Retired)","SOP Class",},//
{0,"1.2.840.10008.5.1.4.1.1.6.1","Ultrasound Image Storage","SOP Class",},//
{0,"1.2.840.10008.5.1.4.1.1.7","Secondary Capture Image Storage","SOP Class",},//
{0,"1.2.840.10008.5.1.4.1.1.7.1","Multi-frame Single Bit Secondary Capture Image Storage","SOP Class",},//
{0,"1.2.840.10008.5.1.4.1.1.7.2","Multi-frame Grayscale Byte Secondary Capture Image Storage","SOP Class",},//
{0,"1.2.840.10008.5.1.4.1.1.7.3","Multi-frame Grayscale Word Secondary Capture Image Storage","SOP Class",},//
{0,"1.2.840.10008.5.1.4.1.1.7.4","Multi-frame True Color Secondary Capture Image Storage","SOP Class",},//
{0,"1.2.840.10008.5.1.4.1.1.8","Standalone Overlay Storage","SOP Class",},//
{0,"1.2.840.10008.5.1.4.1.1.9","Standalone Curve Storage","SOP Class",},//
{0,"1.2.840.10008.5.1.4.1.1.9.1.1","12-lead ECG Waveform Storage","SOP Class",},//
{0,"1.2.840.10008.5.1.4.1.1.9.1.2","General ECG Waveform Storage","SOP Class",},//
{0,"1.2.840.10008.5.1.4.1.1.9.1.3","Ambulatory ECG Waveform Storage","SOP Class",},//
{0,"1.2.840.10008.5.1.4.1.1.9.2.1","Hemodynamic Waveform Storage","SOP Class",},//
{0,"1.2.840.10008.5.1.4.1.1.9.3.1","Cardiac Electrophysiology Waveform Storage","SOP Class",},//
{0,"1.2.840.10008.5.1.4.1.1.9.4.1","Basic Voice Audio Waveform Storage","SOP Class",},//
{0,"1.2.840.10008.5.1.4.1.1.10","Standalone Modality LUT Storage","SOP Class",},//
{0,"1.2.840.10008.5.1.4.1.1.11","Standalone VOI LUT Storage","SOP Class",},//
{0,"1.2.840.10008.5.1.4.1.1.11.1","Grayscale Softcopy Presentation State Storage SOP Class","SOP Class",},//
{0,"1.2.840.10008.5.1.4.1.1.12.1","X-Ray Angiographic Image Storage","SOP Class",},//
{0,"1.2.840.10008.5.1.4.1.1.12.2","X-Ray Radiofluoroscopic Image Storage","SOP Class",},//
{0,"1.2.840.10008.5.1.4.1.1.12.3","X-Ray Angiographic Bi-Plane Image Storage (Retired)","SOP Class",},//
{0,"1.2.840.10008.5.1.4.1.1.20","Nuclear Medicine Image Storage","SOP Class",},//
{0,"1.2.840.10008.5.1.4.1.1.66","Raw Data Storage","SOP Class",},//
{0,"1.2.840.10008.5.1.4.1.1.77.1.1","VL Endoscopic Image Storage","SOP Class",},//
{0,"1.2.840.10008.5.1.4.1.1.77.1.2","VL Microscopic Image Storage","SOP Class",},//
{0,"1.2.840.10008.5.1.4.1.1.77.1.3","VL Slide-Coordinates Microscopic Image Storage","SOP Class",},//
{0,"1.2.840.10008.5.1.4.1.1.77.1.4","VL Photographic Image Storage","SOP Class",},//
{0,"1.2.840.10008.5.1.4.1.1.88.11","Basic Text SR","SOP Class",},//
{0,"1.2.840.10008.5.1.4.1.1.88.22","Enhanced SR","SOP Class",},//
{0,"1.2.840.10008.5.1.4.1.1.88.33","Comprehensive SR","SOP Class",},//
{0,"1.2.840.10008.5.1.4.1.1.88.50","Mammography CAD SR","SOP Class",},//
{0,"1.2.840.10008.5.1.4.1.1.88.59","Key Object Selection Document","SOP Class",},//
{0,"1.2.840.10008.5.1.4.1.1.88.65","Chest CAD SR","SOP Class",},//
{0,"1.2.840.10008.5.1.4.1.1.128","Positron Emission Tomography Image Storage","SOP Class",},//
{0,"1.2.840.10008.5.1.4.1.1.129","Standalone PET Curve Storage","SOP Class",},//
{0,"1.2.840.10008.5.1.4.1.1.481.1","RT Image Storage","SOP Class",},//
{0,"1.2.840.10008.5.1.4.1.1.481.2","RT Dose Storage","SOP Class",},//
{0,"1.2.840.10008.5.1.4.1.1.481.3","RT Structure Set Storage","SOP Class",},//
{0,"1.2.840.10008.5.1.4.1.1.481.4","RT Beams Treatment Record Storage","SOP Class",},//
{0,"1.2.840.10008.5.1.4.1.1.481.5","RT Plan Storage","SOP Class",},//
{0,"1.2.840.10008.5.1.4.1.1.481.6","RT Brachy Treatment Record Storage","SOP Class",},//
{0,"1.2.840.10008.5.1.4.1.1.481.7","RT Treatment Summary Record Storage","SOP Class",},//
{0,"1.2.840.10008.5.1.4.1.2.1.1","Patient Root Query/Retrieve Information Model ? FIND","SOP Class",},//
{0,"1.2.840.10008.5.1.4.1.2.1.2","Patient Root Query/Retrieve Information Model ? MOVE","SOP Class",},//
{0,"1.2.840.10008.5.1.4.1.2.1.3","Patient Root Query/Retrieve Information Model ? GET","SOP Class",},//
{0,"1.2.840.10008.5.1.4.1.2.2.1","Study Root Query/Retrieve Information Model ? FIND","SOP Class",},//
{0,"1.2.840.10008.5.1.4.1.2.2.2","Study Root Query/Retrieve Information Model ? MOVE","SOP Class",},//
{0,"1.2.840.10008.5.1.4.1.2.2.3","Study Root Query/Retrieve Information Model ? GET","SOP Class",},//
{0,"1.2.840.10008.5.1.4.1.2.3.1","Patient/Study Only Query/Retrieve Information Model - FIND","SOP Class",},//
{0,"1.2.840.10008.5.1.4.1.2.3.2","Patient/Study Only Query/Retrieve Information Model - MOVE","SOP Class",},//
{0,"1.2.840.10008.5.1.4.1.2.3.3","Patient/Study Only Query/Retrieve Information Model - GET","SOP Class",},//
{0,"1.2.840.10008.5.1.4.31","Modality Worklist Information Model ? FIND","SOP Class",},//
{0,"1.2.840.10008.5.1.4.32.1","General Purpose Worklist Information Model ? FIND","SOP Class",},//
{0,"1.2.840.10008.5.1.4.32.2","General Purpose Scheduled Procedure Step SOP Class","SOP Class",},//
{0,"1.2.840.10008.5.1.4.32.3","General Purpose Performed Procedure Step SOP Class","SOP Class",},//
{0,"1.2.840.10008.5.1.4.32","General Purpose Worklist Management Meta SOP Class Meta","SOP Class",},//
{0,NULL,NULL,NULL,},//
